<?xml version="1.0" encoding="UTF-8"?>
<tns:dataView xmlns:tns="http://httprobot/rml/datatypes/" xmlns:tns1="http://httprobot/rml/datatypes/placeholders" xmlns:tns2="http://httprobot/rml/datatypes/placeholders/operators" xmlns:xsi="http://www.w3.org/2001/XMLSchema-instance" xsi:schemaLocation="http://httprobot/rml/datatypes/ ../../../../../../../org.httprobot.common/src/org/httprobot/common/xsd/RmlDatatypes.xsd ">
	<tns:fieldRef fieldType="DATETIME">
		<tns:fieldName>lastUpdate</tns:fieldName>
	</tns:fieldRef>
	<tns:fieldRef fieldType="STRING">
		<tns:fieldName>ipAddress</tns:fieldName></tns:fieldRef>
	<tns:fieldRef fieldType="STRING">
		<tns:fieldName>port</tns:fieldName></tns:fieldRef>
	<tns:fieldRef fieldType="STRING">
		<tns:fieldName>country</tns:fieldName>
	</tns:fieldRef>
	<tns:fieldRef fieldType="NUMBER">
		<tns:fieldName>speed</tns:fieldName>
	</tns:fieldRef>
	<tns:fieldRef fieldType="NUMBER">
		<tns:fieldName>upTime</tns:fieldName>
	</tns:fieldRef>
	<tns:fieldRef fieldType="STRING">
		<tns:fieldName>type</tns:fieldName>
	</tns:fieldRef></tns:dataView>
